{
  "$schema": "../../tools/brand/brand.schema.json",
  "id": "helix",
  "productName": "Helix",
  "windowTitle": "Helix",
  "appId": "com.helix.desktop",
  "tagline": "Helix Desktop",
  "description": "Helix —— 基于 cc-haha 的桌面端 Claude Code 工作台（非官方修改版）",

  "logo": {
    "mark": "brand/mark.svg",
    "wordmark": "brand/wordmark.svg",
    "appIcon": "brand/icon.png"
  },

  "author": {
    "name": "doitx.ai",
    "github": "https://github.com/iishows",
    "social": [
      {
        "name": "GitHub",
        "url": "https://github.com/iishows",
        "label": "doitx.ai",
        "icon": "icons/github.svg"
      },
      {
        "name": "Bilibili",
        "url": "https://space.bilibili.com/3461579641194985",
        "label": "doitx.ai",
        "icon": "icons/bilibili.svg"
      },
      {
        "name": "Douyin",
        "url": "https://www.douyin.com/user/MS4wLjABAAAAg-ERYsj2ql8FRzp1YnpFM1oDKOVLI8CEFqKFC7jseIQ",
        "label": "doitx.ai",
        "icon": "icons/douyin.svg"
      },
      {
        "name": "Xiaohongshu",
        "url": "https://www.xiaohongshu.com/user/profile/62da33260000000002002ff3",
        "label": "doitx.ai",
        "icon": "icons/xiaohongshu.svg"
      }
    ]
  },

  "repo": {
    "url": "https://github.com/iishows/helix",
    "issues": "https://github.com/iishows/helix/issues",
    "releases": "https://github.com/iishows/helix/releases",
    "label": "iishows/helix"
  },

  "attribution": {
    "required": true,
    "text": "Based on cc-haha",
    "url": "https://github.com/NanmiCoder/cc-haha",
    "copyright": "Copyright (c) 2026 cc-haha"
  }
}
